<?xml version="1.0" encoding="ISO-8859-1"?>
<Insel xmlns:xsi="http://www.w3.org/2001/XMLSchema-instance" xsi:noNamespaceSchemaLocation="insulae_insel.xsd">
    <Inselheader>
        <Inselname>Edelstein-Insel</Inselname>
        <ID>14</ID>
        <Ursprung>SW-Beta</Ursprung>
        <Ersteller>unbekannt</Ersteller>
        <entdeckt>n</entdeckt>
        <Jahreszeit>1</Jahreszeit>
        <Wirksamkeitsdatum>2016-05-30</Wirksamkeitsdatum>
    </Inselheader>
    <Inselrealisierung>
        <Feld>
            <Position>
                <x>-385</x>
                <y>2</y>
                <w>0</w>
            </Position>
            <Feldart>
                <Landart>1000000000</Landart>
                <Gelaende>462</Gelaende>
            </Feldart>
            <Feldoptionen>
                <bebaubar>j</bebaubar>
                <Strasse>j</Strasse>
                <Landwert>0</Landwert>
            </Feldoptionen>
        </Feld>
        <Feld>
            <Position>
                <x>-385</x>
                <y>2</y>
                <w>0</w>
            </Position>
            <Feldart>
                <Landart>1000000000</Landart>
                <Gelaende>462</Gelaende>
            </Feldart>
            <Feldoptionen>
                <bebaubar>j</bebaubar>
                <Strasse>j</Strasse>
                <Landwert>0</Landwert>
            </Feldoptionen>
        </Feld>
        <Feld>
            <Position>
                <x>-385</x>
                <y>3</y>
                <w>0</w>
            </Position>
            <Feldart>
                <Landart>1000000000</Landart>
                <Gelaende>463</Gelaende>
            </Feldart>
            <Feldoptionen>
                <bebaubar>j</bebaubar>
                <Strasse>j</Strasse>
                <Landwert>0</Landwert>
            </Feldoptionen>
        </Feld>
        <Feld>
            <Position>
                <x>-385</x>
                <y>3</y>
                <w>0</w>
            </Position>
            <Feldart>
                <Landart>1000000000</Landart>
                <Gelaende>463</Gelaende>
            </Feldart>
            <Feldoptionen>
                <bebaubar>j</bebaubar>
                <Strasse>j</Strasse>
                <Landwert>0</Landwert>
            </Feldoptionen>
        </Feld>
        <Feld>
            <Position>
                <x>-385</x>
                <y>4</y>
                <w>0</w>
            </Position>
            <Feldart>
                <Landart>1000000000</Landart>
                <Gelaende>465</Gelaende>
            </Feldart>
            <Feldoptionen>
                <bebaubar>j</bebaubar>
                <Strasse>j</Strasse>
                <Landwert>0</Landwert>
            </Feldoptionen>
        </Feld>
        <Feld>
            <Position>
                <x>-385</x>
                <y>4</y>
                <w>0</w>
            </Position>
            <Feldart>
                <Landart>1000000000</Landart>
                <Gelaende>465</Gelaende>
            </Feldart>
            <Feldoptionen>
                <bebaubar>j</bebaubar>
                <Strasse>j</Strasse>
                <Landwert>0</Landwert>
            </Feldoptionen>
        </Feld>
        <Feld>
            <Position>
                <x>-385</x>
                <y>5</y>
                <w>0</w>
            </Position>
            <Feldart>
                <Landart>1000000000</Landart>
                <Gelaende>490</Gelaende>
            </Feldart>
            <Feldoptionen>
                <bebaubar>j</bebaubar>
                <Strasse>j</Strasse>
                <Landwert>0</Landwert>
            </Feldoptionen>
        </Feld>
        <Feld>
            <Position>
                <x>-385</x>
                <y>5</y>
                <w>0</w>
            </Position>
            <Feldart>
                <Landart>1000000000</Landart>
                <Gelaende>490</Gelaende>
            </Feldart>
            <Feldoptionen>
                <bebaubar>j</bebaubar>
                <Strasse>j</Strasse>
                <Landwert>0</Landwert>
            </Feldoptionen>
        </Feld>
        <Feld>
            <Position>
                <x>-386</x>
                <y>0</y>
                <w>0</w>
            </Position>
            <Feldart>
                <Landart>1000000000</Landart>
                <Gelaende>411</Gelaende>
            </Feldart>
            <Feldoptionen>
                <bebaubar>j</bebaubar>
                <Strasse>j</Strasse>
                <Landwert>0</Landwert>
            </Feldoptionen>
        </Feld>
        <Feld>
            <Position>
                <x>-386</x>
                <y>0</y>
                <w>0</w>
            </Position>
            <Feldart>
                <Landart>1000000000</Landart>
                <Gelaende>411</Gelaende>
            </Feldart>
            <Feldoptionen>
                <bebaubar>j</bebaubar>
                <Strasse>j</Strasse>
                <Landwert>0</Landwert>
            </Feldoptionen>
        </Feld>
        <Feld>
            <Position>
                <x>-386</x>
                <y>1</y>
                <w>0</w>
            </Position>
            <Feldart>
                <Landart>1000000000</Landart>
                <Gelaende>403</Gelaende>
            </Feldart>
            <Feldoptionen>
                <bebaubar>j</bebaubar>
                <Strasse>j</Strasse>
                <Landwert>0</Landwert>
            </Feldoptionen>
        </Feld>
        <Feld>
            <Position>
                <x>-386</x>
                <y>1</y>
                <w>0</w>
            </Position>
            <Feldart>
                <Landart>1000000000</Landart>
                <Gelaende>403</Gelaende>
            </Feldart>
            <Feldoptionen>
                <bebaubar>j</bebaubar>
                <Strasse>j</Strasse>
                <Landwert>0</Landwert>
            </Feldoptionen>
        </Feld>
        <Feld>
            <Position>
                <x>-386</x>
                <y>2</y>
                <w>0</w>
            </Position>
            <Feldart>
                <Landart>1000000000</Landart>
                <Gelaende>202</Gelaende>
            </Feldart>
            <Feldoptionen>
                <bebaubar>j</bebaubar>
                <Strasse>j</Strasse>
                <Landwert>0</Landwert>
            </Feldoptionen>
        </Feld>
        <Feld>
            <Position>
                <x>-386</x>
                <y>2</y>
                <w>0</w>
            </Position>
            <Feldart>
                <Landart>1000000000</Landart>
                <Gelaende>202</Gelaende>
            </Feldart>
            <Feldoptionen>
                <bebaubar>j</bebaubar>
                <Strasse>j</Strasse>
                <Landwert>0</Landwert>
            </Feldoptionen>
        </Feld>
        <Feld>
            <Position>
                <x>-386</x>
                <y>3</y>
                <w>0</w>
            </Position>
            <Feldart>
                <Landart>1000000000</Landart>
                <Gelaende>205</Gelaende>
            </Feldart>
            <Feldoptionen>
                <bebaubar>j</bebaubar>
                <Strasse>j</Strasse>
                <Landwert>0</Landwert>
            </Feldoptionen>
        </Feld>
        <Feld>
            <Position>
                <x>-386</x>
                <y>3</y>
                <w>0</w>
            </Position>
            <Feldart>
                <Landart>1000000000</Landart>
                <Gelaende>205</Gelaende>
            </Feldart>
            <Feldoptionen>
                <bebaubar>j</bebaubar>
                <Strasse>j</Strasse>
                <Landwert>0</Landwert>
            </Feldoptionen>
        </Feld>
        <Feld>
            <Position>
                <x>-386</x>
                <y>4</y>
                <w>0</w>
            </Position>
            <Feldart>
                <Landart>1000000000</Landart>
                <Gelaende>208</Gelaende>
            </Feldart>
            <Feldoptionen>
                <bebaubar>j</bebaubar>
                <Strasse>j</Strasse>
                <Landwert>0</Landwert>
            </Feldoptionen>
        </Feld>
        <Feld>
            <Position>
                <x>-386</x>
                <y>4</y>
                <w>0</w>
            </Position>
            <Feldart>
                <Landart>1000000000</Landart>
                <Gelaende>208</Gelaende>
            </Feldart>
            <Feldoptionen>
                <bebaubar>j</bebaubar>
                <Strasse>j</Strasse>
                <Landwert>0</Landwert>
            </Feldoptionen>
        </Feld>
        <Feld>
            <Position>
                <x>-386</x>
                <y>5</y>
                <w>0</w>
            </Position>
            <Feldart>
                <Landart>1000000000</Landart>
                <Gelaende>483</Gelaende>
            </Feldart>
            <Feldoptionen>
                <bebaubar>j</bebaubar>
                <Strasse>j</Strasse>
                <Landwert>0</Landwert>
            </Feldoptionen>
        </Feld>
        <Feld>
            <Position>
                <x>-386</x>
                <y>5</y>
                <w>0</w>
            </Position>
            <Feldart>
                <Landart>1000000000</Landart>
                <Gelaende>483</Gelaende>
            </Feldart>
            <Feldoptionen>
                <bebaubar>j</bebaubar>
                <Strasse>j</Strasse>
                <Landwert>0</Landwert>
            </Feldoptionen>
        </Feld>
        <Feld>
            <Position>
                <x>-385</x>
                <y>0</y>
                <w>0</w>
            </Position>
            <Feldart>
                <Landart>1000000000</Landart>
                <Gelaende>430</Gelaende>
            </Feldart>
            <Feldoptionen>
                <bebaubar>j</bebaubar>